{
  "arms": {
    "best_of_n": {
      "rate": {
        "denominator": 10,
        "numerator": 9
      },
      "successes": 18,
      "total": 20
    },
    "single_shot": {
      "rate": {
        "denominator": 5,
        "numerator": 1
      },
      "successes": 4,
      "total": 20
    }
  },
  "candidates": "sha256:6590d5ee03e357f23dcc6ff24aaca49d6c3c804c7a8c718dfbf53add5c6e29d6",
  "cases": [
    {
      "case": "e2-case-01",
      "evaluations": [
        {
          "candidate_source_sha256": "sha256:7b47e046b5c1c1966ec816fabb8baf3ed8645e77043c0a90ebc791fba47c5f44",
          "proposal": "sha256:75eb2e303d1582fa718b3bff54dd41f805f302a4187e78e5b8e766aeb575d5ce",
          "rank": 1,
          "results": [
            {
              "kind": "contract_consistency",
              "obligation": "ob00001",
              "status": "verified"
            },
            {
              "kind": "signed_overflow",
              "obligation": "ob00002",
              "status": "verified"
            },
            {
              "kind": "signed_overflow",
              "obligation": "ob00003",
              "status": "verified"
            },
            {
              "kind": "postcondition",
              "obligation": "ob00004",
              "status": "verified"
            }
          ],
          "status": "verified",
          "verification_sha256": "sha256:eb082ea45454475eb1b714d71b7f1f27980366ae0ebf64825c5c9fb3ed85eb4e"
        },
        {
          "candidate_source_sha256": "sha256:a63005f4281097bb4d75fb69eb872be029faf77ed51c2e744f2361184adc83ac",
          "proposal": "sha256:fbce12b22d857a4b7147b9f88a2db2009fc6f09d7939a32d50f3154a3678d7f0",
          "rank": 2,
          "results": [
            {
              "kind": "contract_consistency",
              "obligation": "ob00005",
              "status": "verified"
            },
            {
              "kind": "signed_overflow",
              "obligation": "ob00006",
              "status": "verified"
            },
            {
              "kind": "postcondition",
              "obligation": "ob00007",
              "status": "violated"
            }
          ],
          "status": "violated",
          "verification_sha256": "sha256:1111b984dfd637cb9b1f8fde0e033704845ad0c714485caa3697ab443844564b"
        },
        {
          "candidate_source_sha256": "sha256:36ce653d45028c29759a7646baa2559c43c4eac289aed80d3dbfb119fac0b925",
          "proposal": "sha256:2e91a71f66c04341717577351952e40d63e3176e83ac6b3c86e1c503cc13a9cf",
          "rank": 3,
          "results": [
            {
              "kind": "contract_consistency",
              "obligation": "ob00008",
              "status": "verified"
            },
            {
              "kind": "signed_overflow",
              "obligation": "ob00009",
              "status": "verified"
            },
            {
              "kind": "postcondition",
              "obligation": "ob00010",
              "status": "violated"
            }
          ],
          "status": "violated",
          "verification_sha256": "sha256:b6997b93218e4b878d0d078f343b5fce3ea80a4e978d01f915483a3d7c695118"
        },
        {
          "candidate_source_sha256": "sha256:bf9483f34b0176b72f33d088861f8d4842b4be1cbe5dbd82928acfd5dec54caa",
          "proposal": "sha256:61dc07efc52a6086fa059096e9d08352bbae1b141fae82eac61a8087067d9657",
          "rank": 4,
          "results": [
            {
              "kind": "contract_consistency",
              "obligation": "ob00011",
              "status": "verified"
            },
            {
              "kind": "signed_overflow",
              "obligation": "ob00012",
              "status": "verified"
            },
            {
              "kind": "postcondition",
              "obligation": "ob00013",
              "status": "violated"
            }
          ],
          "status": "violated",
          "verification_sha256": "sha256:488c7aca940499a2c03e0541eae4a1b191cb2e5c68055456edae1b8dbfbeb445"
        }
      ],
      "selected": {
        "proposal": "sha256:75eb2e303d1582fa718b3bff54dd41f805f302a4187e78e5b8e766aeb575d5ce",
        "rank": 1
      },
      "single_shot_verified": true
    },
    {
      "case": "e2-case-02",
      "evaluations": [
        {
          "candidate_source_sha256": "sha256:5f2c30bf7e74391d4b938f893823b1f710ce96a718c4efccb4b19f93b91d8683",
          "proposal": "sha256:bfd3a436223f5fea65171a87e6b956f871298deb4cd36c5377f1a37aa5a0d58b",
          "rank": 1,
          "results": [
            {
              "kind": "contract_consistency",
              "obligation": "ob00014",
              "status": "verified"
            },
            {
              "kind": "signed_overflow",
              "obligation": "ob00015",
              "status": "verified"
            },
            {
              "kind": "postcondition",
              "obligation": "ob00016",
              "status": "verified"
            }
          ],
          "status": "verified",
          "verification_sha256": "sha256:ef3d733af9846573e2c39cb5bd420792cb40ff539ab5fe78a7ef888a0c007125"
        },
        {
          "candidate_source_sha256": "sha256:c623ce4c9a9129f28e4dae08c1efa5eb3710b77cbb33e3ebfa530da608e1fdd9",
          "proposal": "sha256:32c01b16620cc34658166f1b7b9e7071cc72bb063a661bcf7955434c95309f61",
          "rank": 2,
          "results": [
            {
              "kind": "contract_consistency",
              "obligation": "ob00017",
              "status": "verified"
            },
            {
              "kind": "signed_overflow",
              "obligation": "ob00018",
              "status": "verified"
            },
            {
              "kind": "postcondition",
              "obligation": "ob00019",
              "status": "violated"
            }
          ],
          "status": "violated",
          "verification_sha256": "sha256:41884f5acc79044516f0c61b0292e18f168322e5bcb5d8b231e08e68a0468def"
        },
        {
          "candidate_source_sha256": "sha256:add319ecf423baa235c38916f7f8a57ad07ba17ae9790b3eb39828e401c3c9cd",
          "proposal": "sha256:64ac714a553f71ce5d4dd0a36f055a79b940585b063e80663cbb046ba22587e1",
          "rank": 3,
          "results": [
            {
              "kind": "contract_consistency",
              "obligation": "ob00020",
              "status": "verified"
            },
            {
              "kind": "signed_overflow",
              "obligation": "ob00021",
              "status": "verified"
            },
            {
              "kind": "postcondition",
              "obligation": "ob00022",
              "status": "violated"
            }
          ],
          "status": "violated",
          "verification_sha256": "sha256:f4c73b27a54204effd4a3e35b40eab07d24a193d47484c2f7a9f36252e0c5f37"
        },
        {
          "candidate_source_sha256": "sha256:014853c5af193b04eef14056cd333332ad3814d55088d66a155480d0a6c30460",
          "proposal": "sha256:e0476d506425e4867ac8c74c72b71544f780952a9bc466040448350942771f96",
          "rank": 4,
          "results": [
            {
              "kind": "contract_consistency",
              "obligation": "ob00023",
              "status": "verified"
            },
            {
              "kind": "signed_overflow",
              "obligation": "ob00024",
              "status": "verified"
            },
            {
              "kind": "postcondition",
              "obligation": "ob00025",
              "status": "violated"
            }
          ],
          "status": "violated",
          "verification_sha256": "sha256:46249f4f46747f2f9bcaa6698b0efa6d169079a694f65233c7609117c5caf8a9"
        }
      ],
      "selected": {
        "proposal": "sha256:bfd3a436223f5fea65171a87e6b956f871298deb4cd36c5377f1a37aa5a0d58b",
        "rank": 1
      },
      "single_shot_verified": true
    },
    {
      "case": "e2-case-03",
      "evaluations": [
        {
          "candidate_source_sha256": "sha256:93070887a719a06beee06b2787e2a0d56f3519d7304194bad3c21741ed36569e",
          "proposal": "sha256:4fcfb1941328d8fde2ae92e8cb05231733e145675f1f2ee89691442bcf20a6fd",
          "rank": 1,
          "results": [
            {
              "kind": "contract_consistency",
              "obligation": "ob00026",
              "status": "verified"
            },
            {
              "kind": "signed_overflow",
              "obligation": "ob00027",
              "status": "verified"
            },
            {
              "kind": "signed_overflow",
              "obligation": "ob00028",
              "status": "verified"
            },
            {
              "kind": "postcondition",
              "obligation": "ob00029",
              "status": "verified"
            }
          ],
          "status": "verified",
          "verification_sha256": "sha256:d6a71c879ca2cd1e63745db96547b99f949f6287e44bad5721a2f4a8be2df95b"
        },
        {
          "candidate_source_sha256": "sha256:407d75839e34d062b04a939e22ed1d0bb0d510a91dd48e6010ae7f488956960d",
          "proposal": "sha256:8be732fbb02fca28e8dbdfcda54dd1696a1bed323c89f9aa7de3fffc095d8d68",
          "rank": 2,
          "results": [
            {
              "kind": "contract_consistency",
              "obligation": "ob00030",
              "status": "verified"
            },
            {
              "kind": "signed_overflow",
              "obligation": "ob00031",
              "status": "verified"
            },
            {
              "kind": "postcondition",
              "obligation": "ob00032",
              "status": "violated"
            }
          ],
          "status": "violated",
          "verification_sha256": "sha256:34e93dba9a29f0e56f2492157d0dd1873c1d458efb084139d8fd2023dbb541ef"
        },
        {
          "candidate_source_sha256": "sha256:af230738e9feae4f3895fe0f696ef65d9e1fb4aa57cc25b366f4d06fa47226eb",